{
    "comment": "Generated by the nodedescriptor tool based on data provided by the C++ API of the node class",
    "generated": true,
    "library": "libdwframework_dwnodes.so.5.14",
    "name": "dw::framework::dwRelativeEgomotionIMUNode",
    "inputPorts": {
        "IMU_FRAME": {
            "type": "dwIMUFrame"
        },
        "VEHICLE_IO_SAFETY_STATE": {
            "type": "dwVehicleIOSafetyState"
        },
        "VEHICLE_IO_NON_SAFETY_STATE": {
            "type": "dwVehicleIONonSafetyState"
        },
        "VEHICLE_IO_ACTUATION_FEEDBACK": {
            "type": "dwVehicleIOActuationFeedback"
        },
        "IMU_EXTRINSICS": {
            "type": "dwSensorNodeProperties"
        },
        "WHEEL_RADII": {
            "type": "dwCalibratedWheelRadii"
        }
    },
    "outputPorts": {
        "EGOMOTION_STATE": {
            "type": "dwEgomotionStateHandle_t"
        },
        "MODULE_HANDLE": {
            "type": "void*"
        },
        "EGOMOTION_POSE_PAYLOAD": {
            "type": "dwEgomotionPosePayload"
        },
        "IMU_INTRINSICS": {
            "type": "dwCalibratedIMUIntrinsics"
        }
    },
    "parameters": {
        "motionModel": {
            "type": "dwMotionModel"
        },
        "estimateInitialOrientation": {
            "type": "bool"
        },
        "automaticUpdate": {
            "type": "bool"
        },
        "enableSuspension": {
            "type": "bool"
        },
        "historySize": {
            "type": "uint32_t"
        },
        "speedMeasurementType": {
            "type": "dwEgomotionSpeedMeasurementType"
        },
        "linearAccelerationFilterMode": {
            "type": "dwEgomotionLinearAccelerationFilterMode"
        },
        "linearAccelerationFilterTimeConst": {
            "type": "float32_t"
        },
        "linearAccelerationFilterProcessNoiseStdevSpeed": {
            "type": "float32_t"
        },
        "linearAccelerationFilterProcessNoiseStdevAcceleration": {
            "type": "float32_t"
        },
        "linearAccelerationFilterMeasurementNoiseStdevSpeed": {
            "type": "float32_t"
        },
        "linearAccelerationFilterMeasurementNoiseStdevAcceleration": {
            "type": "float32_t"
        }
    },
    "passes": [
        {
            "name": "SETUP",
            "processorTypes": [
                "CPU"
            ]
        },
        {
            "name": "ADD_IMU",
            "processorTypes": [
                "CPU"
            ]
        },
        {
            "name": "ADD_VEHICLE_STATE",
            "processorTypes": [
                "CPU"
            ]
        },
        {
            "name": "UPDATE_IMU_EXTRINSICS",
            "processorTypes": [
                "CPU"
            ]
        },
        {
            "name": "UPDATE_WHEEL_RADII",
            "processorTypes": [
                "CPU"
            ]
        },
        {
            "name": "SEND_STATE",
            "processorTypes": [
                "CPU"
            ]
        },
        {
            "name": "TEARDOWN",
            "processorTypes": [
                "CPU"
            ]
        }
    ]
}
