{
    "comment": "Generated by the nodedescriptor tool based on data provided by the C++ API of the node class",
    "generated": true,
    "library": "libdwframework_dwnodes.so.5.14",
    "name": "dw::framework::dwLidarBatchNode",
    "inputPorts": {
        "SENSOR_EXTRINSICS": {
            "type": "dwCalibratedExtrinsics"
        },
        "VIRTUAL_SYNC_TIME": {
            "type": "dwTime_t"
        }
    },
    "outputPorts": {
        "SENSOR_PROPERTIES": {
            "type": "dwSensorNodeProperties"
        },
        "PROCESSED_DATA": {
            "type": "dwLidarPacketsArray"
        },
        "RAW_DATA": {
            "type": "dwSensorNodeRawData"
        },
        "TIMESTAMP": {
            "type": "dwSensorTsAndID"
        },
        "NEXT_TIMESTAMP": {
            "type": "dwTime_t"
        }
    },
    "parameters": {
        "sensorId": {
            "type": "size_t"
        },
        "frameSkipMask": {
            "type": "dw::core::FixedString<32>"
        }
    },
    "passes": [
        {
            "name": "SETUP",
            "processorTypes": [
                "CPU"
            ]
        },
        {
            "name": "RAW_OUTPUT",
            "processorTypes": [
                "CPU"
            ]
        },
        {
            "name": "PROCESSED_OUTPUT",
            "processorTypes": [
                "CPU"
            ]
        },
        {
            "name": "TEARDOWN",
            "processorTypes": [
                "CPU"
            ]
        }
    ]
}
