{
    "comment": "Generated by the nodedescriptor tool based on data provided by the C++ API of the node class",
    "generated": true,
    "library": "libdwframework_dwnodes.so.5.10",
    "name": "dw::framework::dwSelfCalibrationNode",
    "inputPorts": {
        "EGOMOTION_STATE_ODO_IMU": {
            "type": "dwEgomotionStateHandle_t"
        },
        "VEHICLE_IO_STATE": {
            "type": "dwVehicleIOState"
        },
        "VEHICLE_IO_NON_SAFETY_STATE": {
            "type": "dwVehicleIONonSafetyState"
        },
        "CAMERA_FEATURE_DETECTION": {
            "type": "dwFeatureHistoryArray",
            "array": 13
        },
        "CAMERA_TIMESTAMP": {
            "type": "dwTime_t",
            "array": 13
        },
        "CAMERA_INTRINSICS": {
            "type": "dwCameraIntrinsics",
            "array": 13
        },
        "RADAR_DOPPLER_MOTION": {
            "type": "dwRadarDopplerMotion",
            "array": 9
        },
        "LIDAR_POINT_CLOUD": {
            "type": "dwPointCloud",
            "array": 8
        },
        "LIDAR_POSE": {
            "type": "dwLidarPose",
            "array": 8
        }
    },
    "outputPorts": {
        "CAMERA_EXTRINSICS": {
            "type": "dwCalibratedExtrinsics",
            "array": 13,
            "bindingRequired": true
        },
        "RADAR_EXTRINSICS": {
            "type": "dwCalibratedExtrinsics",
            "array": 9,
            "bindingRequired": true
        },
        "LIDAR_EXTRINSICS": {
            "type": "dwCalibratedExtrinsics",
            "array": 8,
            "bindingRequired": true
        },
        "WHEEL_RADII": {
            "type": "dwCalibratedWheelRadii",
            "bindingRequired": true
        },
        "FRONT_STEERING_OFFSET": {
            "type": "dwCalibratedSteeringProperties",
            "bindingRequired": true
        },
        "MODULE_HANDLE": {
            "type": "void*",
            "bindingRequired": true
        }
    },
    "parameters": {
        "enforceDependencies": {
            "type": "bool"
        },
        "calibrateVehicle": {
            "type": "bool"
        },
        "radarSensorWheelCalibration": {
            "type": "int32_t"
        },
        "cameraSensorIndices": {
            "type": "size_t",
            "array": 13
        },
        "cameraSensorStreamIndices": {
            "type": "size_t",
            "array": 13
        },
        "cameraEnabledMask": {
            "type": "bool",
            "array": 13
        },
        "cameraCalibrationMethod": {
            "type": "uint32_t",
            "array": 13
        },
        "cameraCalibrationSignals": {
            "type": "uint32_t",
            "array": 13
        },
        "radarSensorIndices": {
            "type": "size_t",
            "array": 9
        },
        "radarSensorStreamIndices": {
            "type": "size_t",
            "array": 9
        },
        "radarEnabledMask": {
            "type": "bool",
            "array": 9
        },
        "lidarSensorIndices": {
            "type": "size_t",
            "array": 8
        },
        "lidarSensorStreamIndices": {
            "type": "size_t",
            "array": 8
        },
        "lidarEnabledMask": {
            "type": "bool",
            "array": 8
        },
        "channelFifoSize": {
            "type": "uint32_t"
        }
    },
    "passes": [
        {
            "name": "SETUP",
            "processorTypes": [
                "CPU"
            ]
        },
        {
            "name": "PROCESS_VIO",
            "processorTypes": [
                "CPU"
            ]
        },
        {
            "name": "PROCESS_VEHICLE_IO_NON_SAFETY_STATE",
            "processorTypes": [
                "CPU"
            ]
        },
        {
            "name": "PROCESS_CAMERA_GPU_ASYNC",
            "processorTypes": [
                "GPU"
            ]
        },
        {
            "name": "PROCESS_CAMERA_CPU_SYNC",
            "processorTypes": [
                "CPU"
            ]
        },
        {
            "name": "PROCESS_RADAR",
            "processorTypes": [
                "CPU"
            ]
        },
        {
            "name": "PROCESS_LIDAR_GPU_ASYNC",
            "processorTypes": [
                "GPU"
            ]
        },
        {
            "name": "PROCESS_LIDAR_CPU_SYNC",
            "processorTypes": [
                "CPU"
            ]
        },
        {
            "name": "TEARDOWN",
            "processorTypes": [
                "CPU"
            ]
        }
    ]
}
