{
    "$schema": "../../../../../../doc/3-drive-works-infra/7-基于json的cgf设计/node.schema.json",
    "comment": "Generated by the nodedescriptor tool based on data provided by the C++ API of the node class",
    "generated": true,
    "library": "libdwframework_dwnodes.so.5.8",
    "name": "dw::framework::dwUltrasonicNode",
    "inputPorts": {
        "SENSOR_EXTRINSICS": {
            "type": "dwCalibratedExtrinsics"
        },
        "VIRTUAL_SYNC_TIME": {
            "type": "dwTime_t",
            "bindingRequired": true
        },
        "VEHICLE_STATE": {
            "type": "dwVehicleIOState"
        }
    },
    "outputPorts": {
        "SENSOR_PROPERTIES": {
            "type": "dwSensorNodeProperties"
        },
        "PROCESSED_DATA": {
            "type": "dwUltrasonicGroup"
        },
        "RAW_DATA": {
            "type": "dwSensorNodeRawData"
        },
        "TIMESTAMP": {
            "type": "dwSensorTsAndID"
        },
        "NEXT_TIMESTAMP": {
            "type": "dwTime_t"
        },
        "MOUNTING_POSITIONS": {
            "type": "dwUltrasonicMountingPositions"
        }
    },
    "parameters": {},
    "passes": [
        {
            "name": "SETUP",
            "processorTypes": [
                "CPU"
            ]
        },
        {
            "name": "RAW_OUTPUT",
            "processorTypes": [
                "CPU"
            ]
        },
        {
            "name": "PROCESSED_OUTPUT",
            "processorTypes": [
                "CPU"
            ]
        },
        {
            "name": "TEARDOWN",
            "processorTypes": [
                "CPU"
            ]
        }
    ]
}
