{
    "comment": "Generated by the nodedescriptor tool based on data provided by the C++ API of the node class",
    "generated": true,
    "library": "libdwframework_dwnodes.so.5.10",
    "name": "dw::framework::dwLidarPointCloudStitcherNode",
    "inputPorts": {
        "LIDAR_PACKETS": {
            "type": "dwPointCloud",
            "array": 8
        },
        "LIDAR_EXTRINSICS": {
            "type": "dwSensorNodeProperties",
            "array": 8
        },
        "EGOMOTION_STATE": {
            "type": "dwEgomotionStateHandle_t"
        }
    },
    "outputPorts": {
        "POINT_CLOUD": {
            "type": "dwPointCloud",
            "bindingRequired": true
        },
        "TARGET_TIMESTAMP": {
            "type": "dwTime_t"
        }
    },
    "parameters": {
        "memoryType": {
            "type": "dwMemoryType"
        },
        "outputFormat": {
            "type": "dwPointCloudFormat"
        },
        "stream": {
            "type": "size_t"
        }
    },
    "passes": [
        {
            "name": "SETUP",
            "processorTypes": [
                "CPU"
            ]
        },
        {
            "name": "PROCESS_GPU",
            "processorTypes": [
                "GPU"
            ]
        },
        {
            "name": "PROCESS_CPU",
            "processorTypes": [
                "CPU"
            ]
        },
        {
            "name": "TEARDOWN",
            "processorTypes": [
                "CPU"
            ]
        }
    ]
}
