{
    "comment": "Generated by the nodedescriptor tool based on data provided by the C++ API of the node class",
    "generated": true,
    "library": "libdwframework_dwnodes.so.5.14",
    "name": "dw::framework::dwDepthMapNode",
    "inputPorts": {
        "LIDAR_POINT_CLOUD": {
            "type": "dwLidarPointCloud",
            "bindingRequired": true
        }
    },
    "outputPorts": {
        "DEPTHMAP": {
            "type": "dwPointCloud"
        },
        "SWEEP_SIZE": {
            "type": "dwVector2ui"
        }
    },
    "parameters": {
        "enable": {
            "type": "bool"
        },
        "lidarIndex": {
            "type": "size_t"
        },
        "cudaStreamIndex": {
            "type": "size_t"
        }
    },
    "passes": [
        {
            "name": "SETUP",
            "processorTypes": [
                "CPU"
            ]
        },
        {
            "name": "PASS_PROCESS_DEPTHMAP_GPU_ASYNC",
            "processorTypes": [
                "GPU"
            ]
        },
        {
            "name": "PASS_PROCESS_DEPTHMAP_CPU_SYNC",
            "processorTypes": [
                "CPU"
            ]
        },
        {
            "name": "TEARDOWN",
            "processorTypes": [
                "CPU"
            ]
        }
    ]
}
