{
    "comment": "Generated by the nodedescriptor tool based on data provided by the C++ API of the node class",
    "generated": true,
    "library": "libdwframework_dwnodes.so.5.14",
    "name": "dw::framework::dwSelfCalibrationRadarNode",
    "inputPorts": {
        "VEHICLE_IO_NON_SAFETY_STATE": {
            "type": "dwVehicleIONonSafetyState",
            "bindingRequired": true
        },
        "VEHICLE_IO_ACTUATION_FEEDBACK": {
            "type": "dwVehicleIOActuationFeedback",
            "bindingRequired": true
        },
        "RADAR_DOPPLER_MOTION": {
            "type": "dwRadarDopplerMotion",
            "bindingRequired": true
        },
        "RADAR_SCAN": {
            "type": "dwRadarScan",
            "bindingRequired": true
        },
        "SERVICE_CALIB_ENABLE": {
            "type": "bool"
        }
    },
    "outputPorts": {
        "RADAR_EXTRINSICS": {
            "type": "dwCalibratedExtrinsics",
            "bindingRequired": true
        },
        "WHEEL_RADII": {
            "type": "dwCalibratedWheelRadii"
        },
        "SERVICE_CALIB_ACTIVE": {
            "type": "bool"
        }
    },
    "parameters": {
        "radarSensorIndex": {
            "type": "size_t"
        },
        "calibrateWheelRadii": {
            "type": "bool"
        },
        "enableCalibration": {
            "type": "bool"
        },
        "channelFifoSize": {
            "type": "uint32_t"
        },
        "yawPrecisionDeg": {
            "type": "float32_t"
        }
    },
    "passes": [
        {
            "name": "SETUP",
            "processorTypes": [
                "CPU"
            ]
        },
        {
            "name": "PROCESS",
            "processorTypes": [
                "CPU"
            ]
        },
        {
            "name": "TEARDOWN",
            "processorTypes": [
                "CPU"
            ]
        }
    ]
}
