{
    "comment": "Generated by the nodedescriptor tool based on data provided by the C++ API of the node class",
    "generated": true,
    "library": "libdwframework_dwnodes.so.5.10",
    "name": "dw::framework::dwSelfCalibrationSingleIMUNode",
    "inputPorts": {
        "VEHICLE_IO_STATE": {
            "type": "dwVehicleIOState",
            "bindingRequired": true
        },
        "IMU_FRAME": {
            "type": "dwIMUFrame",
            "bindingRequired": true
        }
    },
    "outputPorts": {
        "IMU_EXTRINSICS": {
            "type": "dwCalibratedExtrinsics",
            "bindingRequired": true
        }
    },
    "parameters": {
        "channelFifoSize": {
            "type": "uint32_t"
        }
    },
    "passes": [
        {
            "name": "SETUP",
            "processorTypes": [
                "CPU"
            ]
        },
        {
            "name": "PROCESS",
            "processorTypes": [
                "CPU"
            ]
        },
        {
            "name": "TEARDOWN",
            "processorTypes": [
                "CPU"
            ]
        }
    ]
}
