{
    "comment": "Generated by the nodedescriptor tool based on data provided by the C++ API of the node class",
    "generated": true,
    "library": "libdwframework_dwnodes.so.5.14",
    "name": "dw::framework::dwIcpNode",
    "inputPorts": {
        "EGOMOTION_STATE_ODO_IMU": {
            "type": "dwEgomotionStateHandle_t",
            "bindingRequired": true
        },
        "DEPTHMAP": {
            "type": "dwPointCloud"
        }
    },
    "outputPorts": {
        "LIDAR_POSE": {
            "type": "dwLidarPose"
        }
    },
    "parameters": {
        "lidarIndex": {
            "type": "size_t"
        },
        "enable": {
            "type": "bool"
        },
        "lidarMaxICPIterations": {
            "type": "uint32_t"
        },
        "accumulatorDownsampleFactor": {
            "type": "uint32_t"
        },
        "lidarICPUsesEgomotion": {
            "type": "bool"
        },
        "cudaStreamIndex": {
            "type": "size_t"
        }
    },
    "passes": [
        {
            "name": "SETUP",
            "processorTypes": [
                "CPU"
            ]
        },
        {
            "name": "PASS_PROCESS_ICP_GPU_ASYNC",
            "processorTypes": [
                "GPU"
            ]
        },
        {
            "name": "PASS_PROCESS_ICP_CPU_SYNC",
            "processorTypes": [
                "CPU"
            ]
        },
        {
            "name": "TEARDOWN",
            "processorTypes": [
                "CPU"
            ]
        }
    ]
}
