{
    "comment": "Generated by the nodedescriptor tool based on data provided by the C++ API of the node class",
    "generated": true,
    "library": "libdwframework_dwnodes.so.5.10",
    "name": "dw::framework::dwVehicleStateChannelNode",
    "inputPorts": {
        "VEHICLE_IO_COMMAND": {
            "type": "dwVehicleIOCommand"
        },
        "VEHICLE_IO_MISC_COMMAND": {
            "type": "dwVehicleIOMiscCommand"
        },
        "VIRTUAL_SYNC_TIME": {
            "type": "dwTime_t"
        },
        "VEHICLE_IO_SAFETY_STATE": {
            "type": "dwVehicleIOSafetyState"
        },
        "VEHICLE_IO_NON_SAFETY_STATE": {
            "type": "dwVehicleIONonSafetyState"
        },
        "VEHICLE_IO_ACTUATION_FEEDBACK": {
            "type": "dwVehicleIOActuationFeedback"
        },
        "INPUT_FRAME": {
            "type": "dwVehicleIOState"
        }
    },
    "outputPorts": {
        "SENSOR_PROPERTIES": {
            "type": "dwSensorNodeProperties"
        },
        "PROCESSED_DATA": {
            "type": "dwVehicleIOState",
            "bindingRequired": true
        },
        "TIMESTAMP": {
            "type": "dwSensorTsAndID"
        },
        "NEXT_TIMESTAMP": {
            "type": "dwTime_t"
        },
        "VEHICLE_IO_SAFETY_STATE": {
            "type": "dwVehicleIOSafetyState"
        },
        "VEHICLE_IO_NON_SAFETY_STATE": {
            "type": "dwVehicleIONonSafetyState"
        },
        "VEHICLE_IO_ACTUATION_FEEDBACK": {
            "type": "dwVehicleIOActuationFeedback"
        },
        "VEHICLE_IO_MISC_COMMAND_OUTPUT": {
            "type": "dwVehicleIOMiscCommand"
        },
        "VEHICLE_IO_COMMAND_OUTPUT": {
            "type": "dwVehicleIOCommand"
        }
    },
    "parameters": {
        "legacyInternal": {
            "type": "bool"
        },
        "legacyExternal": {
            "type": "bool"
        },
        "external": {
            "type": "bool"
        },
        "vioStateRcEnabled": {
            "type": "bool"
        },
        "frameSkipMask": {
            "type": "dw::core::FixedString<32>"
        }
    },
    "passes": [
        {
            "name": "SETUP",
            "processorTypes": [
                "CPU"
            ]
        },
        {
            "name": "PROCESSED_OUTPUT",
            "processorTypes": [
                "CPU"
            ]
        },
        {
            "name": "TEARDOWN",
            "processorTypes": [
                "CPU"
            ]
        }
    ]
}
