{
    "comment": "Generated by the nodedescriptor tool based on data provided by the C++ API of the node class",
    "generated": true,
    "library": "libdwframework_dwnodes.so.5.8",
    "name": "dw::framework::dwLidarPointCloudAccumulatorNode",
    "inputPorts": {
        "LIDAR_PACKETS_ARRAY": {
            "type": "dwLidarPacketsArray"
        },
        "EGOMOTION_STATE": {
            "type": "dwEgomotionStateHandle_t"
        },
        "LIDAR_EXTRINSICS": {
            "type": "dwSensorNodeProperties"
        }
    },
    "outputPorts": {
        "POINT_CLOUD": {
            "type": "dwPointCloud",
            "bindingRequired": true
        },
        "POINT_CLOUD_AVAILABLE": {
            "type": "bool",
            "bindingRequired": true
        },
        "LIDAR_ACCUMULATOR_SWEEP_SIZE": {
            "type": "dwVector2ui",
            "bindingRequired": true
        }
    },
    "parameters": {
        "memoryType": {
            "type": "dwMemoryType"
        },
        "outputFormats": {
            "type": "uint32_t"
        },
        "filterWindowSize": {
            "type": "uint32_t"
        },
        "minAngleDegree": {
            "type": "float32_t"
        },
        "maxAngleDegree": {
            "type": "float32_t"
        },
        "minDistanceMeter": {
            "type": "float32_t"
        },
        "maxDistanceMeter": {
            "type": "float32_t"
        },
        "enableMotionCompensation": {
            "type": "bool"
        },
        "organized": {
            "type": "bool"
        },
        "enableZeroCrossDetection": {
            "type": "bool"
        },
        "outputInRigCoordinates": {
            "type": "bool"
        },
        "sensorId": {
            "type": "size_t"
        },
        "enableEgomotionCompensation": {
            "type": "bool"
        },
        "streamIndex": {
            "type": "size_t"
        }
    },
    "passes": [
        {
            "name": "SETUP",
            "processorTypes": [
                "CPU"
            ]
        },
        {
            "name": "PROCESS_GPU_ASYNC",
            "processorTypes": [
                "GPU"
            ]
        },
        {
            "name": "PROCESS_CPU_SYNC",
            "processorTypes": [
                "CPU"
            ]
        },
        {
            "name": "TEARDOWN",
            "processorTypes": [
                "CPU"
            ]
        }
    ]
}
