{
    "comment": "Generated by the nodedescriptor tool based on data provided by the C++ API of the node class",
    "generated": true,
    "library": "libdwframework_dwnodes.so.5.14",
    "name": "dw::framework::dwCameraNode",
    "inputPorts": {
        "SENSOR_EXTRINSICS": {
            "type": "dwCalibratedExtrinsics"
        },
        "VIRTUAL_SYNC_TIME": {
            "type": "dwTime_t"
        }
    },
    "outputPorts": {
        "SENSOR_PROPERTIES": {
            "type": "dwSensorNodeProperties"
        },
        "INTRINSICS": {
            "type": "dwCameraIntrinsics"
        },
        "IMAGE_NATIVE_RAW": {
            "type": "dwImageHandle_t"
        },
        "IMAGE_NATIVE_PROCESSED": {
            "type": "dwImageHandle_t"
        },
        "IMAGE_PROCESSED_RGBA": {
            "type": "dwImageHandle_t"
        },
        "IMAGE_TIMESTAMP": {
            "type": "dwTime_t"
        },
        "NEXT_IMAGE_TIMESTAMP": {
            "type": "dwTime_t"
        },
        "IMAGE_TIMESTAMP_AND_ID": {
            "type": "dwSensorTsAndID"
        }
    },
    "parameters": {
        "cameraIndex": {
            "type": "size_t"
        },
        "streamIndex": {
            "type": "size_t"
        },
        "useEEPROMIntrinsics": {
            "type": "bool"
        },
        "frameSkipMask": {
            "type": "dw::core::FixedString<32>"
        }
    },
    "passes": [
        {
            "name": "SETUP",
            "processorTypes": [
                "CPU"
            ]
        },
        {
            "name": "RAW_OUTPUT",
            "processorTypes": [
                "GPU"
            ]
        },
        {
            "name": "PROCESSED_OUTPUT",
            "processorTypes": [
                "GPU"
            ]
        },
        {
            "name": "PROCESSED_RGBA_OUTPUT",
            "processorTypes": [
                "GPU"
            ]
        },
        {
            "name": "TEARDOWN",
            "processorTypes": [
                "CPU"
            ]
        }
    ]
}
