{
    "comment": "Generated by the nodedescriptor tool based on data provided by the C++ API of the node class",
    "generated": true,
    "library": "libdwframework_dwnodes.so.5.14",
    "name": "dw::framework::dwSelfCalibrationRadarIntrinsicsNode",
    "inputPorts": {
        "VEHICLE_IO_NON_SAFETY_STATE": {
            "type": "dwVehicleIONonSafetyState",
            "bindingRequired": true
        },
        "VEHICLE_IO_ACTUATION_FEEDBACK": {
            "type": "dwVehicleIOActuationFeedback",
            "bindingRequired": true
        },
        "RADAR_SCAN": {
            "type": "dwRadarScan",
            "bindingRequired": true
        }
    },
    "outputPorts": {
        "RADAR_INTRINSICS": {
            "type": "dwCalibratedRadarIntrinsics",
            "bindingRequired": true
        }
    },
    "parameters": {
        "sensorIndex": {
            "type": "size_t"
        },
        "enableCalibration": {
            "type": "bool"
        }
    },
    "passes": [
        {
            "name": "SETUP",
            "processorTypes": [
                "CPU"
            ]
        },
        {
            "name": "PROCESS",
            "processorTypes": [
                "CPU"
            ]
        },
        {
            "name": "TEARDOWN",
            "processorTypes": [
                "CPU"
            ]
        }
    ]
}
