{
    "comment": "Generated by the nodedescriptor tool based on data provided by the C++ API of the node class",
    "generated": true,
    "library": "libdwframework_dwnodes.so.5.14",
    "name": "dw::framework::dwRadarDopplerMotionNode",
    "inputPorts": {
        "VEHICLE_IO_SAFETY_STATE": {
            "type": "dwVehicleIOSafetyState",
            "bindingRequired": true
        },
        "VEHICLE_IO_NON_SAFETY_STATE": {
            "type": "dwVehicleIONonSafetyState",
            "bindingRequired": true
        },
        "VEHICLE_IO_ACTUATION_FEEDBACK": {
            "type": "dwVehicleIOActuationFeedback",
            "bindingRequired": true
        },
        "RADAR_SCAN": {
            "type": "dwRadarScan",
            "bindingRequired": true
        }
    },
    "outputPorts": {
        "RADAR_DOPPLER_MOTION": {
            "type": "dwRadarDopplerMotion",
            "bindingRequired": true
        }
    },
    "parameters": {
        "index": {
            "type": "size_t"
        },
        "enabled": {
            "type": "bool",
            "array": 9
        },
        "radarDopplerMotionCudaStreamIndices": {
            "type": "size_t",
            "array": 9
        }
    },
    "passes": [
        {
            "name": "SETUP",
            "processorTypes": [
                "CPU"
            ]
        },
        {
            "name": "ADD_VEHICLE_STATE",
            "processorTypes": [
                "CPU"
            ]
        },
        {
            "name": "PROCESS_RADAR_GPU_ASYNC",
            "processorTypes": [
                "GPU"
            ]
        },
        {
            "name": "PROCESS_RADAR_CPU_SYNC",
            "processorTypes": [
                "CPU"
            ]
        },
        {
            "name": "TEARDOWN",
            "processorTypes": [
                "CPU"
            ]
        }
    ]
}
