{
    "comment": "Generated by the nodedescriptor tool based on data provided by the C++ API of the node class",
    "generated": true,
    "library": "libdwframework_dwnodes.so.5.14",
    "name": "dw::framework::dwSelfCalibrationCameraNode",
    "inputPorts": {
        "EGOMOTION_STATE_ODO_IMU": {
            "type": "dwEgomotionStateHandle_t",
            "bindingRequired": true
        },
        "VEHICLE_IO_NON_SAFETY_STATE": {
            "type": "dwVehicleIONonSafetyState",
            "bindingRequired": true
        },
        "CAMERA_FEATURE_DETECTION": {
            "type": "dwFeatureHistoryArray",
            "bindingRequired": true
        },
        "CAMERA_TIMESTAMP": {
            "type": "dwTime_t",
            "bindingRequired": true
        },
        "CAMERA_INTRINSICS": {
            "type": "dwCameraIntrinsics",
            "bindingRequired": true
        },
        "SERVICE_CALIB_ENABLE": {
            "type": "bool"
        }
    },
    "outputPorts": {
        "CAMERA_EXTRINSICS": {
            "type": "dwCalibratedExtrinsics",
            "bindingRequired": true
        },
        "SERVICE_CALIB_ACTIVE": {
            "type": "bool"
        }
    },
    "parameters": {
        "sensorIndex": {
            "type": "size_t"
        },
        "enableCalibration": {
            "type": "bool"
        },
        "cameraCalibrationMethod": {
            "type": "uint32_t"
        },
        "cameraCalibrationSignals": {
            "type": "uint32_t"
        },
        "rotationHistogramRangeDeg": {
            "type": "float32_t"
        },
        "channelFifoSize": {
            "type": "uint32_t"
        },
        "cameraSensorStreamIndex": {
            "type": "size_t"
        }
    },
    "passes": [
        {
            "name": "SETUP",
            "processorTypes": [
                "CPU"
            ]
        },
        {
            "name": "PROCESS_NONCAMERA",
            "processorTypes": [
                "CPU"
            ]
        },
        {
            "name": "PROCESS_CAMERA_GPU_ASYNC",
            "processorTypes": [
                "GPU"
            ]
        },
        {
            "name": "PROCESS_CAMERA_CPU_SYNC",
            "processorTypes": [
                "CPU"
            ]
        },
        {
            "name": "TEARDOWN",
            "processorTypes": [
                "CPU"
            ]
        }
    ]
}
