{
    "comment": "Generated by the nodedescriptor tool based on data provided by the C++ API of the node class",
    "generated": true,
    "library": "libdwframework_dwnodes.so.5.10",
    "name": "dw::framework::dwPointCloudAccumulatorNode",
    "inputPorts": {
        "LIDAR_PACKETS_ARRAY": {
            "type": "dwLidarPacketsArray"
        },
        "EGOMOTION_STATE": {
            "type": "dwEgomotionStateHandle_t"
        },
        "LIDAR_EXTRINSICS": {
            "type": "dwSensorNodeProperties"
        }
    },
    "outputPorts": {
        "POINT_CLOUD": {
            "type": "dwPointCloud",
            "bindingRequired": true
        },
        "POINT_CLOUD_AVAILABLE": {
            "type": "bool",
            "bindingRequired": true
        }
    },
    "parameters": {
        "enableCuda": {
            "type": "bool"
        },
        "interpolationStrategy": {
            "type": "dwMotionCompensatorInterpolationStrategy"
        },
        "maxPointCloudSize": {
            "type": "uint32_t"
        },
        "motionModelResolution": {
            "type": "uint32_t"
        },
        "outputInRigCoordinates": {
            "type": "bool"
        },
        "sensorId": {
            "type": "size_t"
        },
        "enableEgomotionCompensation": {
            "type": "bool"
        },
        "streamIndex": {
            "type": "size_t"
        }
    },
    "passes": [
        {
            "name": "SETUP",
            "processorTypes": [
                "CPU"
            ]
        },
        {
            "name": "PROCESS_ASSM_GPU_ASYNC",
            "processorTypes": [
                "GPU"
            ]
        },
        {
            "name": "PROCESS_ASSM_CPU_SYNC",
            "processorTypes": [
                "CPU"
            ]
        },
        {
            "name": "PROCESS_COMP_GPU_ASYNC",
            "processorTypes": [
                "GPU"
            ]
        },
        {
            "name": "PROCESS_COMP_CPU_SYNC",
            "processorTypes": [
                "CPU"
            ]
        },
        {
            "name": "TEARDOWN",
            "processorTypes": [
                "CPU"
            ]
        }
    ]
}
