{
    "$schema": "../../../../../../doc/3-drive-works-infra/7-基于json的cgf设计/node.schema.json",
    "comment": "Generated by the nodedescriptor tool based on data provided by the C++ API of the node class",
    "generated": true,
    "library": "libdwframework_dwnodes.so.5.8",
    "name": "dw::framework::dwIMUNode",
    "inputPorts": {
        "SENSOR_EXTRINSICS": {
            "type": "dwCalibratedExtrinsics"
        },
        "VIRTUAL_SYNC_TIME": {
            "type": "dwTime_t",
            "bindingRequired": true
        },
        "FRAME_NEW": {
            "type": "dwIMUFrameNew",
            "bindingRequired": true
        }
    },
    "outputPorts": {
        "SENSOR_PROPERTIES": {
            "type": "dwSensorNodeProperties",
            "bindingRequired": true
        },
        "PROCESSED_DATA": {
            "type": "dwIMUFrame",
            "bindingRequired": true
        },
        "RAW_DATA": {
            "type": "dwSensorNodeRawData",
            "bindingRequired": true
        },
        "TIMESTAMP": {
            "type": "dwSensorTsAndID",
            "bindingRequired": true
        },
        "NEXT_TIMESTAMP": {
            "type": "dwTime_t",
            "bindingRequired": true
        },
        "FRAME_NEW": {
            "type": "dwIMUFrameNew",
            "bindingRequired": true
        }
    },
    "parameters": {
        "inputModeVal": {
            "type": "bool",
            "default": false
        }
    },
    "passes": [
        {
            "name": "SETUP",
            "processorTypes": [
                "CPU"
            ]
        },
        {
            "name": "RAW_OUTPUT",
            "processorTypes": [
                "CPU"
            ]
        },
        {
            "name": "PROCESSED_OUTPUT",
            "processorTypes": [
                "CPU"
            ]
        },
        {
            "name": "TEARDOWN",
            "processorTypes": [
                "CPU"
            ]
        }
    ]
}
