{
    "comment": "Generated by the nodedescriptor tool based on data provided by the C++ API of the node class",
    "generated": true,
    "library": "libcgf_custom_nodes.so.5.14",
    "name": "dw::framework::HelloWorldNode",
    "inputPorts": {},
    "outputPorts": {
        "VALUE_0": {
            "type": "int",
            "bindingRequired": true
        },
        "VALUE_1": {
            "type": "int",
            "bindingRequired": true
        }
    },
    "parameters": {
        "name": {
            "type": "dw::core::FixedString<64>"
        }
    },
    "passes": [
        {
            "name": "SETUP",
            "processorTypes": [
                "CPU"
            ]
        },
        {
            "name": "PROCESS",
            "processorTypes": [
                "CPU"
            ]
        },
        {
            "name": "TEARDOWN",
            "processorTypes": [
                "CPU"
            ]
        }
    ]
}
