{
    "comment": "Generated by the nodedescriptor tool based on data provided by the C++ API of the node class",
    "generated": true,
    "library": "libdwframework_dwnodes.so.5.14",
    "name": "dw::framework::dwSelfCalibrationRoadcastAggregatorNode",
    "inputPorts": {
        "IMU_EXTRINSICS": {
            "type": "dwCalibratedExtrinsics",
            "array": 3
        },
        "CAMERA_EXTRINSICS": {
            "type": "dwCalibratedExtrinsics",
            "array": 13
        },
        "RADAR_EXTRINSICS": {
            "type": "dwCalibratedExtrinsics",
            "array": 9
        },
        "LIDAR_EXTRINSICS": {
            "type": "dwCalibratedExtrinsics",
            "array": 8
        },
        "WHEEL_RADII": {
            "type": "dwCalibratedWheelRadii"
        },
        "FRONT_STEERING_OFFSET": {
            "type": "dwCalibratedSteeringProperties"
        },
        "IMU_INTRINSICS": {
            "type": "dwCalibratedIMUIntrinsics",
            "array": 3
        }
    },
    "outputPorts": {
        "ROADCAST_DATA": {
            "type": "dwRoadCastNodeCalibrationDataArray",
            "bindingRequired": true
        },
        "ROADCAST_WHEEL_RADII_DATA": {
            "type": "dwRoadCastNodeCalibrationWheelRadiiData",
            "bindingRequired": true
        },
        "ROADCAST_IMU_INTRINSICS": {
            "type": "dwRoadCastNodeCalibrationIMUIntrinsicsArray",
            "bindingRequired": true
        },
        "ROADCAST_CALIBRATION_SUMMARY": {
            "type": "dwRoadCastNodeCalibrationSummary",
            "bindingRequired": true
        }
    },
    "parameters": {
        "cameraSensorIndices": {
            "type": "size_t",
            "array": 13
        },
        "radarSensorIndices": {
            "type": "size_t",
            "array": 9
        },
        "lidarSensorIndices": {
            "type": "size_t",
            "array": 8
        }
    },
    "passes": [
        {
            "name": "SETUP",
            "processorTypes": [
                "CPU"
            ]
        },
        {
            "name": "PROCESS",
            "processorTypes": [
                "CPU"
            ]
        },
        {
            "name": "TEARDOWN",
            "processorTypes": [
                "CPU"
            ]
        }
    ]
}
