{
    "comment": "Generated by the nodedescriptor tool based on data provided by the C++ API of the node class",
    "generated": true,
    "library": "libdwframework_dwnodes.so.5.10",
    "name": "dw::framework::dwVehicleStateChannelNewNode",
    "inputPorts": {
        "VIRTUAL_SYNC_TIME": {
            "type": "dwTime_t"
        },
        "VEHICLE_IO_SAFETY_STATE": {
            "type": "dwVehicleIOSafetyState"
        },
        "VEHICLE_IO_NON_SAFETY_STATE": {
            "type": "dwVehicleIONonSafetyState"
        },
        "VEHICLE_IO_ACTUATION_FEEDBACK": {
            "type": "dwVehicleIOActuationFeedback"
        }
    },
    "outputPorts": {
        "SENSOR_PROPERTIES": {
            "type": "dwSensorNodeProperties"
        },
        "TIMESTAMP": {
            "type": "dwSensorTsAndID"
        },
        "NEXT_TIMESTAMP": {
            "type": "dwTime_t"
        },
        "VEHICLE_IO_SAFETY_STATE": {
            "type": "dwVehicleIOSafetyState"
        },
        "VEHICLE_IO_NON_SAFETY_STATE": {
            "type": "dwVehicleIONonSafetyState"
        },
        "VEHICLE_IO_ACTUATION_FEEDBACK": {
            "type": "dwVehicleIOActuationFeedback"
        }
    },
    "parameters": {
        "safetyState": {
            "type": "bool"
        },
        "noneSafetyState": {
            "type": "bool"
        },
        "actuationFeedback": {
            "type": "bool"
        },
        "vioStateRcEnabled": {
            "type": "bool"
        },
        "frameSkipMask": {
            "type": "dw::core::FixedString<32>"
        }
    },
    "passes": [
        {
            "name": "SETUP",
            "processorTypes": [
                "CPU"
            ]
        },
        {
            "name": "PROCESSED_OUTPUT",
            "processorTypes": [
                "CPU"
            ]
        },
        {
            "name": "TEARDOWN",
            "processorTypes": [
                "CPU"
            ]
        }
    ]
}
